quarter	class_name	teacher_name	exceptions	class_price	maximum_students	day_of_the_week	start_time	end_time	room	ages	link	status	condition	description
2024 Spring	Beyond the Family Tree	Allison Rozell Tatum	No class April 3	115	8	Wednesday	10	11	Room 3	7 - 18	https://apm.activecommunities.com/seattle/Activity_Search/homeschool-beyond-the-family-tree/58879			Join us as we explore individual and family culture. Each of us has a support network, and families can be formed in many ways. Through a variety of creative projects, students will focus on the stories and traditions that make them unique.
2024 Spring	Circus Arts	Six Impossible Things		180	10	Wednesday	2.5	3.5	Room 2	11 - 18	https://apm.activecommunities.com/seattle/Activity_Search/homeschool-circus-arts/58878			Come and join the circus for a session! Seemingly complicated skills such as juggling, acrobatics, and tumbling are broken down so that anyone can learn and experience success. In this introduction to circus arts, students will be able to find that practice and hard work can make the impossible possible.
2024 Spring	Hip Hop and Jazz Dance	Metropolis Dance		175	12	Wednesday	12.5	1.5	Room 4	7 - 11	https://apm.activecommunities.com/seattle/Activity_Search/homeschool-hiphop-jazz/58888			Learn the fundamentals of Hip-Hop and Jazz dance in this fun fusion class! Both styles will be incorporated through basic movement, activities, and games. A choreographed dance will be taught throughout the session to perform on the last day of class!
2024 Spring	Papier Mache	Stephanie Burkemoore		165	12	Wednesday	11	12	Room 4	9 - 18	https://apm.activecommunities.com/seattle/Activity_Search/homeschool-papier-mache/58884	Full		In this sometimes-messy, always hands-on class you’ll learn and complete the basic steps to creating a small papier mache project. A couple of techniques will be introduced with time to practice. No experience is necessary. Supplies - including wheat-based flour, salt, and newspaper - will be provided.
2024 Spring	Parkour in Gym	Six Impossible Things		180	10	Wednesday	11	12	Gym	7 - 12	https://apm.activecommunities.com/seattle/Activity_Search/homeschool-parkour/58883	Full		Parkour is an art as old as humans: finding the most efficient way with only your body to get from point A to point B. Seen in action movie chases or even in a playground game of tag, parkour unleashes your inner monkey as you run, climb, and vault your way through obstacles. This class focuses on finding safe and legal ways to pursue this art that can make participants feel free in their bodies. This class will meet inside for warmups, the second half of the class will be held outside.
2024 Spring	Parkour in Room 2	Six Impossible Things		180	10	Wednesday	12.5	1.5	Room 2	7 - 12	https://apm.activecommunities.com/seattle/Activity_Search/homeschool-parkour/58882	Full		Parkour is an art as old as humans: finding the most efficient way with only your body to get from point A to point B. Seen in action movie chases or even in a playground game of tag, parkour unleashes your inner monkey as you run, climb, and vault your way through obstacles. This class focuses on finding safe and legal ways to pursue this art that can make participants feel free in their bodies. This class will meet inside for warmups, the second half of the class will be held outside.
2024 Spring	Quilting	Stefanie Kahler		127	8	Wednesday	10.5	12	Room 2	12 - 18	https://apm.activecommunities.com/seattle/Activity_Search/homeschool-quilting/58881			Winter got you feeling cold? Come warm up as you create your own quilt! We'll be using sewing machines to make functional art. New students learn machine safety and sewing techniques, while more experienced students expand their skills. Supplies not included, please see supply list.
2024 Spring	Tinkergarten	Malinda Sorci		175	10	Wednesday	10	11	Outside	2 - 8	https://apm.activecommunities.com/seattle/Activity_Search/homeschool-tinkergarten/58886			Through outdoor exploration following Tinkergarten’s curriculum, students and their grown-ups will use song, movement, and purposeful play to capture imagination, connect with nature, and build key skills needed for students to thrive. Each season has a different focus, but we will always learn about animals while nurturing our innate sense of curiosity. I can’t wait to see you outside!
2024 Spring	Tumbling	Six Impossible Things		170	10	Wednesday	1.5	2.5	Room 2	7 - 12	https://apm.activecommunities.com/seattle/Activity_Search/homeschool-tumbling/58887	Full		Cartwheel, roll, or even flip your way into tumbling! This all levels course promises to improve your tumbling skills in a safe, fun, and disciplined atmosphere. Various skills like round offs or front tucks are introduced and broken down into manageable drills so participants can move at their own pace. Individualized instruction assures that each student may meet a personal challenge in every class and consistently progress. Get ready to stand in your hands and jump off your feet!
2024 Spring	Unraveling Recess Games	Malinda Sorci		155	12	Wednesday	12.5	1.5	Gym	6 - 12	https://apm.activecommunities.com/seattle/Activity_Search/homeschool-unraveling-recess-games/58877			Come play with us! Using recess games as a backdrop, we will explore a variety of interpersonal skills that encourage social-emotional growth. We will learn the rules and histories of various outdoor games (and even create some of our own), all the while deepening our sense of community and growing empathy.
2024 Spring	Watercolor	Shannon Hillinger		105	15	Wednesday	1.5	2.5	Room 4	9 - 18	https://apm.activecommunities.com/seattle/Activity_Search/homeschool-watercolor/58890	Full		In this class we will focus on the basic techniques of watercolor. Each week we will practice a skill and then do a painting that uses that technique. You will get the chance to paint many things, from galaxies to penguins.
2024 Spring	Weather Science	Shannon Hillinger		105	12	Wednesday	10	11	Room 4	3 - 8	https://apm.activecommunities.com/seattle/Activity_Search/homeschool-weather-science/58880			Why does it rain? How do tornadoes form? What is a scattered shower? In this class we will do hands on projects to learn about and experience weather of all kinds.No actual tornadoes will be brought into the classroom. But there may be snow!
2024 Spring	Fish Hawk ~ Wednesdays	Briana McFarland		430 / $380 sibling rate		Wednesday	9.5	11.5	Offsite	7 - 9	https://www.ignitenatureconnection.com/program/fish-hawk-spring-session-2024-wednesdays-at-carkeek-park		Location: Carkeek Park	This is a weekly program designed for children to become immersed in a community who come together in the outdoors to build on the skills and practices of nature connection. A collective environment which allows children to build community through shared experiences and deepen connection with earth and each other. We begin each day with an acknowledgement of gratitude for the natural world around us and everything that it provides. Children learn quickly and authentically to identify all of the things around them in which they are grateful for. This is a precious and important practice and a theme that is held throughout the day. Students are taught how to safely use knives as tools for skills such as fire building, carving and crafting. There is a strong focus on community building through working together on shelter creating, fire building, cooperative nature games and conflict resolution.
2024 Spring	Fish Hawk ~ Thursdays	Briana McFarland		860 / $700 sibling rate		Thursday	9.5	12	Offsite	6 - 11			Location: Carkeek Park	This is a weekly program designed for children to become immersed in a community who come together in the outdoors to build on the skills and practices of nature connection. A collective environment which allows children to build community through shared experiences and deepen connection with earth and each other. We begin each day with an acknowledgement of gratitude for the natural world around us and everything that it provides. Children learn quickly and authentically to identify all of the things around them in which they are grateful for. This is a precious and important practice and a theme that is held throughout the day. Students are taught how to safely use knives as tools for skills such as fire building, carving and crafting. There is a strong focus on community building through working together on shelter creating, fire building, cooperative nature games and conflict resolution.
2024 Spring	Break					Wednesday	12	12.5						
2024 Spring	Open Gym					Wednesday	1.5	3.5	Gym					
2024 Spring	Park Play					Wednesday	12.5	3.5	Outside					
